{
  "behavioral_config_sha256": "d4167fa6d6088261c5df275c98fc81366657b4bcf800c9f54a0711189b560c32",
  "candidate_nonce": "33981b89ab8d407a73fe6c6bb4836624fa55f7f7d31703831345652b7bcb210c",
  "challenge_occurrence_utc": "2026-08-27T02:08:00Z",
  "cohort_id": "CAL-BR-013-v25-5b253778-r4",
  "fresh_evidence_consumed": false,
  "generation_head_sha": "84d36645a5ac369cce2f09ac844e5fa89fb2d3ee",
  "generation_root_sha": "5b253778f1319e2ed90e2e11aef7c4fec1997488",
  "github_preactivation_write_reachability": true,
  "github_read_reachability": true,
  "normalized_first_production_utc": "2026-08-27T06:08:00Z",
  "preactivation_branch": "ps/preactivate/CAL-BR-013-v25-5b253778-r4/MF04",
  "preactivation_path": "preactivation/CAL-BR-013-v25-5b253778-r4/MF04.json",
  "production_branch": "ps/work/CAL-BR-013-v25-5b253778-r4/MF04",
  "production_not_before_utc": "2026-08-27T06:00:00Z",
  "production_path": "reports/CAL-BR-013-v25-5b253778-r4/MF04.json",
  "production_write_performed": false,
  "protocol_version": "2.5",
  "role_auth_commitment": "47c507c6241d66ef9660f02153682a8a792cec5853ad605a853d862ea29b399e",
  "role_auth_proof": "9b64a576057b1ebe8aa3d1b55947a2d4e24ace5c6142ff79d9056b4ce8d85f90",
  "role_auth_scheme": "PS-HMAC-SHA256-PREACTIVATION-RECEIPT-1",
  "role_id": "MF04",
  "runtime_effect": "NONE",
  "runtime_state_id": "9d0a88cc9001295b5e4c0f4163e83c0fd64ce04521e34230ad3539af14f3dfaf",
  "scheduler_manifest_git_identity": "1078ab6aa58404c78652d168740d9fb9f44753cf",
  "scheduler_task_id": "6a84164c7bb0819192e2750f51587099",
  "scheduler_wakeup_observed": true,
  "schema_version": "PS-PREACTIVATION-RECEIPT-2.5-3",
  "scientific_state_effect": "NONE",
  "staged_candidate_git_identity": "37fbc7895fcf36ddde938a3482ab1ed422c80c1a",
  "staged_candidate_loaded": true,
  "task_network_plan_id": "0aa341106cfc5b104ab9ca9c2ae116d490a258685e28d26d5435860c53bb12aa"
}
