{
  "behavioral_config_sha256": "0753776627095cb4db97553fea89e10c27cf397f717218bde289c29338d56a39",
  "candidate_nonce": "33981b89ab8d407a73fe6c6bb4836624fa55f7f7d31703831345652b7bcb210c",
  "challenge_occurrence_utc": "2026-08-27T02:16:00Z",
  "cohort_id": "CAL-BR-013-v25-5b253778-r4",
  "fresh_evidence_consumed": false,
  "generation_head_sha": "84d36645a5ac369cce2f09ac844e5fa89fb2d3ee",
  "generation_root_sha": "5b253778f1319e2ed90e2e11aef7c4fec1997488",
  "github_preactivation_write_reachability": true,
  "github_read_reachability": true,
  "normalized_first_production_utc": "2026-08-27T06:16:00Z",
  "preactivation_branch": "ps/preactivate/CAL-BR-013-v25-5b253778-r4/EXT01",
  "preactivation_path": "preactivation/CAL-BR-013-v25-5b253778-r4/EXT01.json",
  "production_branch": "ps/work/CAL-BR-013-v25-5b253778-r4/EXT01",
  "production_not_before_utc": "2026-08-27T06:00:00Z",
  "production_path": "reports/CAL-BR-013-v25-5b253778-r4/EXT01.json",
  "production_write_performed": false,
  "protocol_version": "2.5",
  "role_auth_commitment": "bbc84b9b5dd9955cb85411198f10f3a789c1f8afbac9282b280b0e1421fdf50e",
  "role_auth_proof": "f89c03ae421a497462d3574ba5794a49189892182ec347db8b28800003b1ef35",
  "role_auth_scheme": "PS-HMAC-SHA256-PREACTIVATION-RECEIPT-1",
  "role_id": "EXT01",
  "runtime_effect": "NONE",
  "runtime_state_id": "9d0a88cc9001295b5e4c0f4163e83c0fd64ce04521e34230ad3539af14f3dfaf",
  "scheduler_manifest_git_identity": "1078ab6aa58404c78652d168740d9fb9f44753cf",
  "scheduler_task_id": "6a84192d0f888191a4aaa9523fc07d7e",
  "scheduler_wakeup_observed": true,
  "schema_version": "PS-PREACTIVATION-RECEIPT-2.5-3",
  "scientific_state_effect": "NONE",
  "staged_candidate_git_identity": "37fbc7895fcf36ddde938a3482ab1ed422c80c1a",
  "staged_candidate_loaded": true,
  "task_network_plan_id": "0aa341106cfc5b104ab9ca9c2ae116d490a258685e28d26d5435860c53bb12aa"
}
