{"behavioral_config_sha256":"cffad3c7227b90d7ef6c50b90261c98fdb21e67fc4b110fc18c4ca68f4114c21","candidate_nonce":"33981b89ab8d407a73fe6c6bb4836624fa55f7f7d31703831345652b7bcb210c","challenge_occurrence_utc":"2026-08-27T02:45:00Z","cohort_id":"CAL-BR-013-v25-5b253778-r4","fresh_evidence_consumed":false,"generation_head_sha":"84d36645a5ac369cce2f09ac844e5fa89fb2d3ee","generation_root_sha":"5b253778f1319e2ed90e2e11aef7c4fec1997488","github_preactivation_write_reachability":true,"github_read_reachability":true,"normalized_first_production_utc":"2026-08-27T08:45:00Z","preactivation_branch":"ps/preactivate/CAL-BR-013-v25-5b253778-r4/MF06","preactivation_path":"preactivation/CAL-BR-013-v25-5b253778-r4/MF06.json","production_branch":"ps/integrate/CAL-BR-013-v25-5b253778-r4","production_not_before_utc":"2026-08-27T06:00:00Z","production_path":"integration/CAL-BR-013-v25-5b253778-r4.json","production_write_performed":false,"protocol_version":"2.5","role_auth_commitment":"e43c554cc7fcae9cc6039a3e9c521fc728ebe09ef408b29152886cfcf668ef97","role_auth_proof":"e523edec1cba2d6148d6aef0d3bf3689ab4747a88e58a8b8934f22d14854f178","role_auth_scheme":"PS-HMAC-SHA256-PREACTIVATION-RECEIPT-1","role_id":"MF06","runtime_effect":"NONE","runtime_state_id":"9d0a88cc9001295b5e4c0f4163e83c0fd64ce04521e34230ad3539af14f3dfaf","scheduler_manifest_git_identity":"1078ab6aa58404c78652d168740d9fb9f44753cf","scheduler_task_id":"6a841697574481918e67222cacb7fcfb","scheduler_wakeup_observed":true,"schema_version":"PS-PREACTIVATION-RECEIPT-2.5-3","scientific_state_effect":"NONE","staged_candidate_git_identity":"37fbc7895fcf36ddde938a3482ab1ed422c80c1a","staged_candidate_loaded":true,"task_network_plan_id":"0aa341106cfc5b104ab9ca9c2ae116d490a258685e28d26d5435860c53bb12aa"}